,symbol,name,area,industry,fullname,enname,market,list_date,code,exchange
1038,002589,瑞康医药,山东,医药商业,瑞康医药集团股份有限公司,"Realcan Pharmaceutical Group Co., Ltd.",中小板,20110610,sz.002589,深
1039,002590,万安科技,浙江,汽车配件,浙江万安科技股份有限公司,"Zhejiang Vie Science & Technology Co.,Ltd.",中小板,20110610,sz.002590,深
1040,002591,恒大高新,江西,化工原料,江西恒大高新技术股份有限公司,"Jiangxi Hengda Hi-Tech Co., Ltd.",中小板,20110621,sz.002591,深
1041,002592,ST八菱,广西,汽车配件,南宁八菱科技股份有限公司,"Nanning Baling Technology Co.,Ltd.",中小板,20111111,sz.002592,深
1042,002593,日上集团,福建,汽车配件,厦门日上集团股份有限公司,"Xiamen Sunrise Group Co.,Ltd",中小板,20110628,sz.002593,深
1043,002594,比亚迪,深圳,汽车整车,比亚迪股份有限公司,BYD Company Limited,中小板,20110630,sz.002594,深
1044,002595,豪迈科技,山东,专用机械,山东豪迈机械科技股份有限公司,"Himile Mechanical Science and Technology (Shandong) Co.,Ltd",中小板,20110628,sz.002595,深
1045,002596,海南瑞泽,海南,其他建材,海南瑞泽新型建材股份有限公司,"Hainan Ruize New Building Material Co.,Ltd.",中小板,20110707,sz.002596,深
1046,002597,金禾实业,安徽,食品,安徽金禾实业股份有限公司,"Anhui Jinhe Industrial Co.,Ltd.",中小板,20110707,sz.002597,深
1047,002598,山东章鼓,山东,机械基件,山东省章丘鼓风机股份有限公司,"Shandong Zhangqiu Blower Co.,Ltd",中小板,20110707,sz.002598,深
1048,002599,盛通股份,北京,广告包装,北京盛通印刷股份有限公司,"Beijing Shengtong Printing Co.,Ltd",中小板,20110715,sz.002599,深
1049,002600,领益智造,广东,元器件,广东领益智造股份有限公司,Lingyi Itech (Guangdong) Company,中小板,20110715,sz.002600,深
1050,002601,龙蟒佰利,河南,化工原料,龙蟒佰利联集团股份有限公司,"Lomon Billions Group Co.,Ltd",中小板,20110715,sz.002601,深
1051,002602,世纪华通,浙江,互联网,浙江世纪华通集团股份有限公司,"Zhejiang Century Huatong Group Co.,Ltd",中小板,20110728,sz.002602,深
1052,002603,以岭药业,河北,中成药,石家庄以岭药业股份有限公司,"Shijiazhuang Yiling Pharmaceutical Co., Ltd",中小板,20110728,sz.002603,深
1053,002605,姚记科技,上海,互联网,上海姚记科技股份有限公司,"Shanghai Yaoji Technology Co., Ltd.",中小板,20110805,sz.002605,深
1054,002606,大连电瓷,辽宁,电气设备,大连电瓷集团股份有限公司,"Dalian Insulator Group Co.,Ltd.",中小板,20110805,sz.002606,深
1055,002607,中公教育,安徽,文教休闲,中公教育科技股份有限公司,"Offcn Education Technology Co., Ltd.",中小板,20110810,sz.002607,深
1056,002608,江苏国信,江苏,火力发电,江苏国信股份有限公司,"Jiangsu Guoxin Corp., Ltd.",中小板,20110810,sz.002608,深
1057,002609,捷顺科技,深圳,软件服务,深圳市捷顺科技实业股份有限公司,"Shenzhen Jieshun Science and Technology Industry Co., Ltd.",中小板,20110815,sz.002609,深
1058,002610,爱康科技,江苏,电气设备,江苏爱康科技股份有限公司,"Jiangsu Akcome Science & Technology Co.,Ltd.",中小板,20110815,sz.002610,深
1059,002611,东方精工,广东,轻工机械,广东东方精工科技股份有限公司,"Guangdong Dongfang Precision Science & Technology Co.,Ltd.",中小板,20110830,sz.002611,深
1060,002612,朗姿股份,北京,服饰,朗姿股份有限公司,"Lancy Co., Ltd",中小板,20110830,sz.002612,深
1061,002613,北玻股份,河南,专用机械,洛阳北方玻璃技术股份有限公司,"Luoyang Northglass Technology Co.,Ltd",中小板,20110830,sz.002613,深
1062,002614,奥佳华,福建,医疗保健,奥佳华智能健康科技集团股份有限公司,"Xiamen Comfort Science&Technology Group Co., Ltd.",中小板,20110909,sz.002614,深
1063,002615,哈尔斯,浙江,家居用品,浙江哈尔斯真空器皿股份有限公司,"Zhejiang Haers Vacuum Containers Co.,Ltd.",中小板,20110909,sz.002615,深
1064,002616,长青集团,广东,环境保护,广东长青(集团)股份有限公司,Guangdong Chant Group Inc.,中小板,20110920,sz.002616,深
1065,002617,露笑科技,浙江,电气设备,露笑科技股份有限公司,"Roshow Technology Co., Ltd.",中小板,20110920,sz.002617,深
1066,002618,*ST丹邦,深圳,元器件,深圳丹邦科技股份有限公司,"Shenzhen Danbond Technology Co.,Ltd.",中小板,20110920,sz.002618,深
1067,002619,*ST艾格,浙江,互联网,艾格拉斯股份有限公司,"Egls Co.,Ltd.",中小板,20110929,sz.002619,深
1068,002620,瑞和股份,深圳,装修装饰,深圳瑞和建筑装饰股份有限公司,"Shenzhen Ruihe Construction Decoration Co., Ltd.",中小板,20110929,sz.002620,深
1069,002621,美吉姆,辽宁,文教休闲,大连美吉姆教育科技股份有限公司,"Dalian My Gym Education Technology Co.,Ltd.",中小板,20110929,sz.002621,深
1070,002622,融钰集团,吉林,综合类,融钰集团股份有限公司,"Rongyu Group Co.,Ltd.",中小板,20111018,sz.002622,深
1071,002623,亚玛顿,江苏,玻璃,常州亚玛顿股份有限公司,"Changzhou Almaden Co., Ltd.",中小板,20111013,sz.002623,深
1072,002624,完美世界,浙江,影视音像,完美世界股份有限公司,"Perfect World Co., Ltd.",中小板,20111028,sz.002624,深
1073,002625,光启技术,深圳,汽车配件,光启技术股份有限公司,"Kuang-Chi Technologies Co., Ltd.",中小板,20111103,sz.002625,深
1074,002626,金达威,福建,食品,厦门金达威集团股份有限公司,Xiamen Kingdomway Group Company,中小板,20111028,sz.002626,深
1075,002627,宜昌交运,湖北,公共交通,湖北宜昌交运集团股份有限公司,"Hubei Yichang Transportation Group Co.,Ltd.",中小板,20111103,sz.002627,深
1076,002628,成都路桥,四川,建筑工程,成都市路桥工程股份有限公司,"Chengdu Road & Bridge Engineering Co.,Ltd",中小板,20111103,sz.002628,深
1077,002629,ST仁智,浙江,石油开采,浙江仁智股份有限公司,"Zhejiang Renzhi Co.,Ltd.",中小板,20111103,sz.002629,深
1078,002630,华西能源,四川,专用机械,华西能源工业股份有限公司,"China Western Power Industrial Co., Ltd.",中小板,20111111,sz.002630,深
1079,002631,德尔未来,江苏,家居用品,德尔未来科技控股集团股份有限公司,"Der Future Science and Technology Holding Group Co., Ltd.",中小板,20111111,sz.002631,深
1080,002632,道明光学,浙江,化工原料,道明光学股份有限公司,"Daoming Optics&Chemical Co.,Ltd",中小板,20111122,sz.002632,深
1081,002633,申科股份,浙江,机械基件,申科滑动轴承股份有限公司,Shenke Slide Bearing Corporation,中小板,20111122,sz.002633,深
1082,002634,棒杰股份,浙江,服饰,浙江棒杰控股集团股份有限公司,"Zhejiang Bangjie Holding Group Co.,Ltd",中小板,20111205,sz.002634,深
1083,002635,安洁科技,江苏,IT设备,苏州安洁科技股份有限公司,"Suzhou Anjie Technology Co., Ltd.",中小板,20111125,sz.002635,深
1084,002636,金安国纪,上海,元器件,金安国纪科技股份有限公司,Goldenmax International Technology Ltd.,中小板,20111125,sz.002636,深
1085,002637,赞宇科技,浙江,日用化工,赞宇科技集团股份有限公司,"Zanyu Technology Group Co., Ltd.",中小板,20111125,sz.002637,深
1086,002638,*ST勤上,广东,文教休闲,东莞勤上光电股份有限公司,"Dongguan Kingsun Optoelectronic Co.,Ltd.",中小板,20111125,sz.002638,深
1087,002639,雪人股份,福建,专用机械,福建雪人股份有限公司,"Fujian Snowman Co., Ltd",中小板,20111205,sz.002639,深
1088,002640,*ST跨境,山西,互联网,跨境通宝电子商务股份有限公司,"Global Top E-Commerce Co.,Ltd.",中小板,20111208,sz.002640,深
1089,002641,永高股份,浙江,塑料,永高股份有限公司,"Yonggao Co., Ltd.",中小板,20111208,sz.002641,深
1090,002642,荣联科技,北京,软件服务,荣联科技集团股份有限公司,Ronglian Group Ltd.,中小板,20111220,sz.002642,深
1091,002643,万润股份,山东,化工原料,中节能万润股份有限公司,"Valiant Co.,Ltd",中小板,20111220,sz.002643,深
1092,002644,佛慈制药,甘肃,中成药,兰州佛慈制药股份有限公司,"Lanzhou Foci Pharmaceutical Co., Ltd.",中小板,20111222,sz.002644,深
1093,002645,华宏科技,江苏,专用机械,江苏华宏科技股份有限公司,"Jiangsu Huahong Technology Co., Ltd.",中小板,20111220,sz.002645,深
1094,002646,青青稞酒,青海,白酒,青海互助青稞酒股份有限公司,"Qinghai Huzhu Barley Wine Co.,Ltd.",中小板,20111222,sz.002646,深
1095,002647,仁东控股,浙江,多元金融,仁东控股股份有限公司,"Rendong Holdings Co., Ltd.",中小板,20111228,sz.002647,深
1096,002648,卫星石化,浙江,化工原料,浙江卫星石化股份有限公司,"Zhejiang Satellite Petrochemical Co., Ltd.",中小板,20111228,sz.002648,深
1097,002649,博彦科技,北京,软件服务,博彦科技股份有限公司,Beyondsoft Corporation,中小板,20120106,sz.002649,深
1098,002650,ST加加,湖南,食品,加加食品集团股份有限公司,"Jiajia Food Group Co.,Ltd.",中小板,20120106,sz.002650,深
1099,002651,利君股份,四川,专用机械,成都利君实业股份有限公司,"Chengdu Leejun Industrial Co., Ltd.",中小板,20120106,sz.002651,深
1100,002652,扬子新材,江苏,其他建材,苏州扬子江新型材料股份有限公司,"Suzhou Yangtze New Materials Co.,Ltd.",中小板,20120119,sz.002652,深
1101,002653,海思科,西藏,化学制药,海思科医药集团股份有限公司,"Haisco Pharmaceutical Group Co., Ltd.",中小板,20120117,sz.002653,深
1102,002654,万润科技,深圳,互联网,深圳万润科技股份有限公司,"Shenzhen Mason Technologies Co., Ltd.",中小板,20120217,sz.002654,深
1103,002655,共达电声,山东,元器件,共达电声股份有限公司,"Gettop Acoustic Co., Ltd",中小板,20120217,sz.002655,深
1104,002656,ST摩登,广东,服饰,摩登大道时尚集团股份有限公司,"Modern Avenue Group Co., Ltd.",中小板,20120228,sz.002656,深
1105,002657,中科金财,北京,软件服务,北京中科金财科技股份有限公司,"Sinodata Co., Ltd.",中小板,20120228,sz.002657,深
1106,002658,雪迪龙,北京,环境保护,北京雪迪龙科技股份有限公司,"Beijing SDL Technology Co.,Ltd",中小板,20120309,sz.002658,深
1107,002659,凯文教育,北京,文教休闲,北京凯文德信教育科技股份有限公司,"Beijing Kaiwen Education Technology Co., Ltd",中小板,20120309,sz.002659,深
1108,002660,茂硕电源,深圳,电气设备,茂硕电源科技股份有限公司,"Moso Power Supply Technology Co., Ltd",中小板,20120316,sz.002660,深
1109,002661,克明面业,湖南,食品,克明面业股份有限公司,"Kemen Noodle Manufacturing Co.,Ltd",中小板,20120316,sz.002661,深
1110,002662,京威股份,北京,汽车配件,北京威卡威汽车零部件股份有限公司,"Beijing WKW Automotive Parts Co., Ltd.",中小板,20120309,sz.002662,深
1111,002663,普邦股份,广东,建筑工程,广州普邦园林股份有限公司,"Pubang Landscape Architecture Co.,Ltd",中小板,20120316,sz.002663,深
1112,002664,长鹰信质,浙江,汽车配件,长鹰信质科技股份有限公司,"Changying Xinzhi Technology Co.,Ltd.",中小板,20120316,sz.002664,深
1113,002665,首航高科,甘肃,电气设备,首航高科能源技术股份有限公司,"Shouhang High-Tech Energy Co., Ltd",中小板,20120327,sz.002665,深
1114,002666,德联集团,广东,化工原料,广东德联集团股份有限公司,"Guangdong Delian Group Co., Ltd",中小板,20120327,sz.002666,深
1115,002667,鞍重股份,辽宁,工程机械,鞍山重型矿山机器股份有限公司,"Anshan Heavy Duty Mining Machinery Co., Ltd.",中小板,20120329,sz.002667,深
1116,002668,奥马电器,广东,家用电器,广东奥马电器股份有限公司,"Guangdong Homa Group Co., Ltd.",中小板,20120416,sz.002668,深
1117,002669,康达新材,上海,化工原料,上海康达化工新材料集团股份有限公司,"Shanghai Kangda New Materials Group Co., Ltd",中小板,20120416,sz.002669,深
1118,002670,国盛金控,广东,证券,国盛金融控股集团股份有限公司,Guosheng Financial Holding Inc.,中小板,20120416,sz.002670,深
1119,002671,龙泉股份,山东,其他建材,山东龙泉管道工程股份有限公司,"Shandong Longquan Pipeline Engineering Co.,Ltd",中小板,20120426,sz.002671,深
1120,002672,东江环保,深圳,环境保护,东江环保股份有限公司,Dongjiang Environmental Company Limited,中小板,20120426,sz.002672,深
1121,002673,西部证券,陕西,证券,西部证券股份有限公司,"Western Securities Co., Ltd",中小板,20120503,sz.002673,深
1122,002674,兴业科技,福建,纺织,兴业皮革科技股份有限公司,"Xingye Leather Technology Co.,Ltd.",中小板,20120507,sz.002674,深
1123,002675,东诚药业,山东,化学制药,烟台东诚药业集团股份有限公司,"Yantai Dongcheng Biochemicals Co.,Ltd",中小板,20120525,sz.002675,深
1124,002676,顺威股份,广东,塑料,广东顺威精密塑料股份有限公司,"Guangdong Sunwill Precising Plastic Co.,Ltd.",中小板,20120525,sz.002676,深
1125,002677,浙江美大,浙江,家用电器,浙江美大实业股份有限公司,"Zhejiang Meida Industrial Co.,Ltd.",中小板,20120525,sz.002677,深
1126,002678,珠江钢琴,广东,文教休闲,广州珠江钢琴集团股份有限公司,"Guangzhou Pearl River Piano Group Co.,Ltd",中小板,20120530,sz.002678,深
1127,002679,福建金森,福建,林业,福建金森林业股份有限公司,"Fujian Jinsen Forestry Co., Ltd.",中小板,20120605,sz.002679,深
1128,002681,奋达科技,深圳,家用电器,深圳市奋达科技股份有限公司,"Shenzhen Fenda Technology Co., Ltd.",中小板,20120605,sz.002681,深
1129,002682,龙洲股份,福建,公路,龙洲集团股份有限公司,"Longzhou Group Co.,Ltd.",中小板,20120612,sz.002682,深
1130,002683,宏大爆破,广东,化工原料,广东宏大爆破股份有限公司,"Guangdong Hongda Blasting Co.,Ltd",中小板,20120612,sz.002683,深
1131,002684,*ST猛狮,河南,电气设备,猛狮新能源科技(河南)股份有限公司,"Dynavolt Renewable Energy Technology (Henan) Co., Ltd.",中小板,20120612,sz.002684,深
1132,002685,华东重机,江苏,工程机械,无锡华东重型机械股份有限公司,"Wuxi Huadong Heavy Machinery Co., Ltd.",中小板,20120612,sz.002685,深
1133,002686,亿利达,浙江,专用机械,浙江亿利达风机股份有限公司,"Zhejiang Yilida Ventilator Co.,Ltd.",中小板,20120703,sz.002686,深
1134,002687,乔治白,浙江,服饰,浙江乔治白服饰股份有限公司,"Zhejiang Giuseppe Garment Co., Ltd",中小板,20120713,sz.002687,深
1135,002688,金河生物,内蒙,化学制药,金河生物科技股份有限公司,"Jinhe Biotechnology CO.,LTD.",中小板,20120713,sz.002688,深
1136,002689,远大智能,辽宁,运输设备,沈阳远大智能工业集团股份有限公司,"Shenyang Yuanda Intellectual Industry Group Co.,Ltd",中小板,20120717,sz.002689,深
1137,002690,美亚光电,安徽,专用机械,合肥美亚光电技术股份有限公司,Hefei Meyer Optoelectronic Technology Inc.,中小板,20120731,sz.002690,深
1138,002691,冀凯股份,河北,专用机械,冀凯装备制造股份有限公司,"Jikai Equipment Manufacturing Co., Ltd.",中小板,20120731,sz.002691,深
1139,002692,ST远程,江苏,电气设备,远程电缆股份有限公司,"Yuan Cheng Cable Co.,Ltd.",中小板,20120808,sz.002692,深
1140,002693,双成药业,海南,化学制药,海南双成药业股份有限公司,"Hainan Shuangcheng Pharmaceuticals Co., Ltd.",中小板,20120808,sz.002693,深
1141,002694,顾地科技,湖北,塑料,顾地科技股份有限公司,"Goody Science & Technology Co.,Ltd.",中小板,20120816,sz.002694,深
1142,002695,煌上煌,江西,食品,江西煌上煌集团食品股份有限公司,"Jiangxi Huangshanghuang Group Food Co., Ltd.",中小板,20120905,sz.002695,深
1143,002696,百洋股份,广西,渔业,百洋产业投资集团股份有限公司,"Baiyang Investment Group,Inc.",中小板,20120905,sz.002696,深
1144,002697,红旗连锁,四川,超市连锁,成都红旗连锁股份有限公司,"Chengdu Hongqi Chain Co., Ltd.",中小板,20120905,sz.002697,深
1145,002698,博实股份,黑龙江,化工机械,哈尔滨博实自动化股份有限公司,"Harbin Boshi Automation Co., Ltd.",中小板,20120911,sz.002698,深
1146,002699,美盛文化,浙江,影视音像,美盛文化创意股份有限公司,"Meisheng Cultural & Creative Corp, Ltd.",中小板,20120911,sz.002699,深
1147,002700,ST浩源,新疆,供气供热,新疆浩源天然气股份有限公司,"Xinjiang Haoyuan Natural Gas Co.,Ltd.",中小板,20120921,sz.002700,深
1148,002701,奥瑞金,北京,广告包装,奥瑞金科技股份有限公司,"ORG Technology Co.,Ltd.",中小板,20121011,sz.002701,深
1149,002702,海欣食品,福建,食品,海欣食品股份有限公司,"Haixin Foods Co.,Ltd.",中小板,20121011,sz.002702,深
1150,002703,浙江世宝,浙江,汽车配件,浙江世宝股份有限公司,Zhejiang Shibao Company Limited,中小板,20121102,sz.002703,深
1151,002705,新宝股份,广东,家用电器,广东新宝电器股份有限公司,"Guangdong Xinbao Electrical Appliances Holdings Co.,Ltd",中小板,20140121,sz.002705,深
1152,002706,良信股份,上海,电气设备,上海良信电器股份有限公司,"Shanghai Liangxin Electrical Co.,LTD.",中小板,20140121,sz.002706,深
1153,002707,众信旅游,北京,旅游服务,众信旅游集团股份有限公司,"Utour Group Co., Ltd.",中小板,20140123,sz.002707,深
1154,002708,光洋股份,江苏,汽车配件,常州光洋轴承股份有限公司,Changzhou Nrb Corporation,中小板,20140121,sz.002708,深
1155,002709,天赐材料,广东,化工原料,广州天赐高新材料股份有限公司,"Guangzhou Tinci Materials Technology Co., Ltd.",中小板,20140123,sz.002709,深
1156,002712,思美传媒,浙江,广告包装,思美传媒股份有限公司,"Simei Media Co.,Ltd",中小板,20140123,sz.002712,深
1157,002713,东易日盛,北京,装修装饰,东易日盛家居装饰集团股份有限公司,"Dong Yi Ri Sheng Home Decoration Group Co.,Ltd.",中小板,20140219,sz.002713,深
1158,002714,牧原股份,河南,农业综合,牧原食品股份有限公司,"Muyuan Foods Co.,Ltd.",中小板,20140128,sz.002714,深
1159,002715,登云股份,广东,汽车配件,怀集登云汽配股份有限公司,"Huaiji Dengyun Auto-Parts (Holding) Co.,Ltd.",中小板,20140219,sz.002715,深
1160,002716,金贵银业,湖南,小金属,郴州市金贵银业股份有限公司,"Chenzhou City Jingui Silver Industry Co., Ltd",中小板,20140128,sz.002716,深
1161,002717,岭南股份,广东,环境保护,岭南生态文旅股份有限公司,"Lingnan Eco&Culture-Tourism Co., Ltd.",中小板,20140219,sz.002717,深
1162,002718,友邦吊顶,浙江,家居用品,浙江友邦集成吊顶股份有限公司,"Zhejiang Youpon Integrated Ceiling Co., Ltd.",中小板,20140128,sz.002718,深
1163,002719,*ST麦趣,新疆,乳制品,麦趣尔集团股份有限公司,"Maiquer Group Co.,Ltd",中小板,20140128,sz.002719,深
1164,002721,金一文化,北京,服饰,北京金一文化发展股份有限公司,"Beijing Kingee Culture Development Co.,Ltd.",中小板,20140127,sz.002721,深
1165,002722,金轮股份,江苏,纺织机械,金轮蓝海股份有限公司,"Geron Co., Ltd.",中小板,20140128,sz.002722,深
1166,002723,金莱特,广东,家用电器,广东金莱特电器股份有限公司,"Kennede Electronics MFG. Co., Ltd.",中小板,20140129,sz.002723,深
1167,002724,海洋王,深圳,半导体,海洋王照明科技股份有限公司,"Ocean'S King Lighting Science & Technology Co., Ltd.",中小板,20141104,sz.002724,深
1168,002725,跃岭股份,浙江,汽车配件,浙江跃岭股份有限公司,"Zhejiang Yueling Co.,Ltd",中小板,20140129,sz.002725,深
1169,002726,龙大肉食,山东,食品,山东龙大肉食品股份有限公司,"Shandong Longda Meat Foodstuff Co.,Ltd.",中小板,20140626,sz.002726,深
1170,002727,一心堂,云南,医药商业,一心堂药业集团股份有限公司,"Yixintang Pharmaceutical Co., Ltd.",中小板,20140702,sz.002727,深
1171,002728,特一药业,广东,中成药,特一药业集团股份有限公司,"TEYI PHARMACEUTICAL GROUP CO.,LTD",中小板,20140731,sz.002728,深
1172,002729,好利来,福建,元器件,好利来(中国)电子科技股份有限公司,"Hollyland (China) Electronics Technology Corp.,Ltd.",中小板,20140912,sz.002729,深
1173,002730,电光科技,浙江,电气设备,电光防爆科技股份有限公司,"Dianguang Explosion-Proof Technology Co., Ltd.",中小板,20141009,sz.002730,深
1174,002731,萃华珠宝,辽宁,服饰,沈阳萃华金银珠宝股份有限公司,"Shenyang Cuihua Gold and Silver Jewelry Co., Ltd.",中小板,20141104,sz.002731,深
1175,002732,燕塘乳业,广东,乳制品,广东燕塘乳业股份有限公司,"Guangdong Yantang Dairy Co.,Ltd.",中小板,20141205,sz.002732,深
1176,002733,雄韬股份,深圳,电气设备,深圳市雄韬电源科技股份有限公司,"Shenzhen Center Power Tech Co.,Ltd.",中小板,20141203,sz.002733,深
1177,002734,利民股份,江苏,农药化肥,利民控股集团股份有限公司,"Limin Group Co., Ltd.",中小板,20150127,sz.002734,深
1178,002735,王子新材,深圳,塑料,深圳王子新材料股份有限公司,"Shenzhen Prince New Materials Co.,Ltd.",中小板,20141203,sz.002735,深
1179,002736,国信证券,深圳,证券,国信证券股份有限公司,"Guosen Securities Co.,Ltd.",中小板,20141229,sz.002736,深
1180,002737,葵花药业,黑龙江,中成药,葵花药业集团股份有限公司,"Sunflower Pharmaceutical Group Co.,Ltd",中小板,20141230,sz.002737,深
1181,002738,中矿资源,北京,小金属,中矿资源集团股份有限公司,"Sinomine Resource Group Co., Ltd.",中小板,20141230,sz.002738,深
1182,002739,万达电影,北京,影视音像,万达电影股份有限公司,"Wanda Film Holding Co., Ltd",中小板,20150122,sz.002739,深
1183,002740,爱迪尔,福建,服饰,福建省爱迪尔珠宝实业股份有限公司,"Fujian Ideal Jewellery Industrial Co.,Ltd",中小板,20150122,sz.002740,深
1184,002741,光华科技,广东,化工原料,广东光华科技股份有限公司,"Guangdong Guanghua Sci-Tech Co., Ltd",中小板,20150216,sz.002741,深
1185,002742,三圣股份,重庆,其他建材,重庆三圣实业股份有限公司,"Chongqing Sansheng Industrial Co.,Ltd.",中小板,20150217,sz.002742,深
1186,002743,富煌钢构,安徽,钢加工,安徽富煌钢构股份有限公司,"Anhui Fuhuang Steel Structure Co.,Ltd.",中小板,20150217,sz.002743,深
1187,002745,木林森,广东,电气设备,木林森股份有限公司,"MLS Co.,Ltd.",中小板,20150217,sz.002745,深
1188,002746,仙坛股份,山东,农业综合,山东仙坛股份有限公司,"Shandong Xiantan Co.,Ltd.",中小板,20150216,sz.002746,深
1189,002747,埃斯顿,江苏,机械基件,南京埃斯顿自动化股份有限公司,"Estun Automation Co.,Ltd",中小板,20150320,sz.002747,深
1190,002748,世龙实业,江西,化工原料,江西世龙实业股份有限公司,"Jiangxi Selon Industrial Co., Ltd.",中小板,20150319,sz.002748,深
1191,002749,国光股份,四川,农药化肥,四川国光农化股份有限公司,"Sichuan Guoguang Agrochemical Co., Ltd.",中小板,20150320,sz.002749,深
1192,002750,龙津药业,云南,中成药,昆明龙津药业股份有限公司,"Kunming Longjin Pharmaceutical Co., Ltd.",中小板,20150324,sz.002750,深
1193,002751,易尚展示,深圳,家居用品,深圳市易尚展示股份有限公司,"Shenzhen ESUN Display Co., Ltd.",中小板,20150424,sz.002751,深
1194,002752,昇兴股份,福建,广告包装,昇兴集团股份有限公司,Sunrise Group Company Limited,中小板,20150422,sz.002752,深
1195,002753,永东股份,山西,化工原料,山西永东化工股份有限公司,"Shanxi Yongdong Chemistry Industry Co.,Ltd.",中小板,20150519,sz.002753,深
1196,002755,奥赛康,北京,化学制药,北京奥赛康药业股份有限公司,"Beijing Aosaikang Pharmaceutical Co., Ltd.",中小板,20150515,sz.002755,深
1197,002756,永兴材料,浙江,特种钢,永兴特种材料科技股份有限公司,"Yongxing Special Materials Technology Co.,Ltd",中小板,20150515,sz.002756,深
1198,002757,南兴股份,广东,专用机械,南兴装备股份有限公司,"Nanxing Machinery Co., Ltd.",中小板,20150527,sz.002757,深
1199,002758,浙农股份,浙江,医药商业,浙农集团股份有限公司,"ZJAMP Group Co., Ltd.",中小板,20150527,sz.002758,深
1200,002759,天际股份,广东,家用电器,广东天际电器股份有限公司,"Guangdong Tonze Electric Co.,Ltd.",中小板,20150528,sz.002759,深
1201,002760,凤形股份,安徽,机械基件,安徽省凤形耐磨材料股份有限公司,"Anhui Fengxing Wear Resistant Materials Co.,Ltd.",中小板,20150611,sz.002760,深
1202,002761,浙江建投,浙江,建筑工程,浙江省建设投资集团股份有限公司,"Zhejiang Construction Investment Group Co.,Ltd",中小板,20150610,sz.002761,深
1203,002762,金发拉比,广东,服饰,金发拉比妇婴童用品股份有限公司,"Jinfa Labi Maternity & Baby Articles Co., Ltd.",中小板,20150610,sz.002762,深
1204,002763,汇洁股份,深圳,服饰,深圳汇洁集团股份有限公司,"Shenzhen Huijie Group Co., Ltd.",中小板,20150610,sz.002763,深
1205,002765,蓝黛科技,重庆,汽车配件,蓝黛科技集团股份有限公司,"Landai Technology Group Corp., Ltd.",中小板,20150612,sz.002765,深
1206,002766,*ST索菱,深圳,汽车配件,深圳市索菱实业股份有限公司,"Shenzhen Soling Industrial Co.,Ltd.",中小板,20150611,sz.002766,深
1207,002767,先锋电子,浙江,电器仪表,杭州先锋电子技术股份有限公司,"Hangzhou Innover Technology Co., Ltd.",中小板,20150612,sz.002767,深
