,symbol,name,area,industry,fullname,enname,market,list_date,code,exchange
3230,600984,建设机械,陕西,工程机械,陕西建设机械股份有限公司,"Shaanxi Construction Machinery Co.,Ltd",主板,20040707,sh.600984,沪
3231,600985,淮北矿业,安徽,煤炭开采,淮北矿业控股股份有限公司,"Huaibei Mining Holdings Co.,Ltd.",主板,20040428,sh.600985,沪
3232,600986,浙文互联,山东,互联网,浙文互联集团股份有限公司,"Zhewen Interactive Group Co., Ltd.",主板,20040426,sh.600986,沪
3233,600987,航民股份,浙江,纺织,浙江航民股份有限公司,"Zhejiang Hangmin Co.,Ltd",主板,20040809,sh.600987,沪
3234,600988,赤峰黄金,内蒙,黄金,赤峰吉隆黄金矿业股份有限公司,"Chifeng Jilong Gold Mining Co.,Ltd.",主板,20040414,sh.600988,沪
3235,600989,宝丰能源,宁夏,化工原料,宁夏宝丰能源集团股份有限公司,"Ningxia Baofeng Energy Group Co.,Ltd.",主板,20190516,sh.600989,沪
3236,600990,四创电子,安徽,通信设备,四创电子股份有限公司,"SUN-CREATE ELECTRONICS CO.,LTD",主板,20040510,sh.600990,沪
3237,600992,贵绳股份,贵州,钢加工,贵州钢绳股份有限公司,"Guizhou Wire Rope Co., Ltd",主板,20040514,sh.600992,沪
3238,600993,马应龙,湖北,中成药,马应龙药业集团股份有限公司,"Mayinglong Pharmaceutical Group Co.,Ltd",主板,20040517,sh.600993,沪
3239,600995,文山电力,云南,水力发电,云南文山电力股份有限公司,"Yunnan Wenshan Electric Power Co.,Ltd.",主板,20040615,sh.600995,沪
3240,600996,贵广网络,贵州,影视音像,贵州省广播电视信息网络股份有限公司,"Guizhou BC&TV Information Network CO.,LTD",主板,20161226,sh.600996,沪
3241,600997,开滦股份,河北,煤炭开采,开滦能源化工股份有限公司,"Kailuan Energy Chemical Co.,Ltd.",主板,20040602,sh.600997,沪
3242,600998,九州通,湖北,医药商业,九州通医药集团股份有限公司,"Jointown Pharmaceutical Group Co., Ltd",主板,20101102,sh.600998,沪
3243,600999,招商证券,深圳,证券,招商证券股份有限公司,"China Merchants Securities Co., Ltd",主板,20091117,sh.600999,沪
3244,601000,唐山港,河北,港口,唐山港集团股份有限公司,"Tangshan Port Group Co.,Ltd.",主板,20100705,sh.601000,沪
3245,601001,晋控煤业,山西,煤炭开采,晋能控股山西煤业股份有限公司,"Jinneng Holding Shanxi Coal Industry Co.,Ltd",主板,20060623,sh.601001,沪
3246,601002,晋亿实业,浙江,机械基件,晋亿实业股份有限公司,"Gem-Year Industrial Co.,Ltd.",主板,20070126,sh.601002,沪
3247,601003,柳钢股份,广西,普钢,柳州钢铁股份有限公司,"Liuzhou Iron & Steel Co.,Ltd.",主板,20070227,sh.601003,沪
3248,601005,重庆钢铁,重庆,普钢,重庆钢铁股份有限公司,Chongqing Iron & Steel Company Limited,主板,20070228,sh.601005,沪
3249,601006,大秦铁路,山西,铁路,大秦铁路股份有限公司,"Daqin Railway Co., Ltd.",主板,20060801,sh.601006,沪
3250,601007,金陵饭店,江苏,酒店餐饮,金陵饭店股份有限公司,"Jinling Hotel Corporation, Ltd.",主板,20070406,sh.601007,沪
3251,601008,连云港,江苏,港口,江苏连云港港口股份有限公司,"Jiangsu Lianyungang Port Co.,Ltd.",主板,20070426,sh.601008,沪
3252,601009,南京银行,江苏,银行,南京银行股份有限公司,"Bank of Nanjing Co.,Ltd.",主板,20070719,sh.601009,沪
3253,601010,文峰股份,江苏,超市连锁,文峰大世界连锁发展股份有限公司,Wenfeng Great World Chain Development Corporation,主板,20110603,sh.601010,沪
3254,601011,宝泰隆,黑龙江,焦炭加工,宝泰隆新材料股份有限公司,"Baotailong New Materials Co.,Ltd",主板,20110309,sh.601011,沪
3255,601012,隆基股份,陕西,电气设备,隆基绿能科技股份有限公司,"Longi Green Energy Technology Co., Ltd.",主板,20120411,sh.601012,沪
3256,601015,陕西黑猫,陕西,焦炭加工,陕西黑猫焦化股份有限公司,"Shaanxi Heimao Coking Co., Ltd.",主板,20141105,sh.601015,沪
3257,601016,节能风电,北京,新型电力,中节能风力发电股份有限公司,CECEP Wind-Power Corporation,主板,20140929,sh.601016,沪
3258,601018,宁波港,浙江,港口,宁波舟山港股份有限公司,Ningbo Zhoushan Port Company Limited,主板,20100928,sh.601018,沪
3259,601019,山东出版,山东,出版业,山东出版传媒股份有限公司,"Shandong Publishing & Media Co.,Ltd",主板,20171122,sh.601019,沪
3260,601020,ST华钰,西藏,铅锌,西藏华钰矿业股份有限公司,"Tibet Huayu Mining Co.,Ltd.",主板,20160316,sh.601020,沪
3261,601021,春秋航空,上海,空运,春秋航空股份有限公司,"Spring Airlines Co., Ltd.",主板,20150121,sh.601021,沪
3262,601028,玉龙股份,江苏,商贸代理,山东玉龙黄金股份有限公司,"Shandong Yulong Gold Co., Ltd.",主板,20111107,sh.601028,沪
3263,601038,一拖股份,河南,农用机械,第一拖拉机股份有限公司,First Tractor Company Limited,主板,20120808,sh.601038,沪
3264,601058,赛轮轮胎,山东,汽车配件,赛轮集团股份有限公司,"Sailun Group Co.,Ltd.",主板,20110630,sh.601058,沪
3265,601066,中信建投,北京,证券,中信建投证券股份有限公司,"China Securities Co.,Ltd.",主板,20180620,sh.601066,沪
3266,601068,中铝国际,北京,建筑工程,中铝国际工程股份有限公司,China Aluminum International Engineering Corporation Limited,主板,20180831,sh.601068,沪
3267,601069,西部黄金,新疆,黄金,西部黄金股份有限公司,"Western Region Gold Co.,Ltd",主板,20150122,sh.601069,沪
3268,601077,渝农商行,重庆,银行,重庆农村商业银行股份有限公司,"Chongqing Rural Commercial Bank Co.,Ltd.",主板,20191029,sh.601077,沪
3269,601086,国芳集团,甘肃,百货,甘肃国芳工贸(集团)股份有限公司,Gansu Guofang Industry & Trade Group Limited by Share Ltd.,主板,20170929,sh.601086,沪
3270,601088,中国神华,北京,煤炭开采,中国神华能源股份有限公司,China Shenhua Energy Company Limited,主板,20071009,sh.601088,沪
3271,601098,中南传媒,湖南,出版业,中南出版传媒集团股份有限公司,"China South Publishing & Media Group Co., Ltd",主板,20101028,sh.601098,沪
3272,601099,太平洋,云南,证券,太平洋证券股份有限公司,"The Pacific Securities Co.,Ltd.",主板,20071228,sh.601099,沪
3273,601100,恒立液压,江苏,工程机械,江苏恒立液压股份有限公司,"Jiangsu Hengli  Hydraulic  CO.,Ltd.",主板,20111028,sh.601100,沪
3274,601101,昊华能源,北京,煤炭开采,北京昊华能源股份有限公司,"Beijing Haohua Energy Resource Co.,Ltd.",主板,20100331,sh.601101,沪
3275,601106,中国一重,黑龙江,工程机械,中国第一重型机械股份公司,China First Heavy Industries,主板,20100209,sh.601106,沪
3276,601107,四川成渝,四川,路桥,四川成渝高速公路股份有限公司,Sichuan Expressway Company Limited,主板,20090727,sh.601107,沪
3277,601108,财通证券,浙江,证券,财通证券股份有限公司,"Caitong Securities Co.,Ltd.",主板,20171024,sh.601108,沪
3278,601111,中国国航,北京,空运,中国国际航空股份有限公司,Air China Limited,主板,20060818,sh.601111,沪
3279,601113,ST华鼎,浙江,化纤,义乌华鼎锦纶股份有限公司,"Yiwu Huading Nylon Co.,Ltd.",主板,20110509,sh.601113,沪
3280,601116,三江购物,浙江,超市连锁,三江购物俱乐部股份有限公司,"Sanjiang Shopping Club Co.,Ltd",主板,20110302,sh.601116,沪
3281,601117,中国化学,北京,建筑工程,中国化学工程股份有限公司,"China National Chemical Engineering Co., Ltd.",主板,20100107,sh.601117,沪
3282,601118,海南橡胶,海南,橡胶,海南天然橡胶产业集团股份有限公司,"China Hainan Rubber Industry Group Co., Ltd.",主板,20110107,sh.601118,沪
3283,601126,四方股份,北京,电气设备,北京四方继保自动化股份有限公司,"Beijing Sifang Automation Co.,Ltd",主板,20101231,sh.601126,沪
3284,601127,小康股份,重庆,汽车配件,重庆小康工业集团股份有限公司,"Chongqing Sokon Industry Group Stock Co.,Ltd.",主板,20160615,sh.601127,沪
3285,601128,常熟银行,江苏,银行,江苏常熟农村商业银行股份有限公司,"Jiangsu Changshu Rural Commercial Bank Co.,Ltd.",主板,20160930,sh.601128,沪
3286,601137,博威合金,浙江,铜,宁波博威合金材料股份有限公司,Ningbo Boway Alloy Material Company Limited,主板,20110127,sh.601137,沪
3287,601138,工业富联,深圳,通信设备,富士康工业互联网股份有限公司,"Foxconn Industrial Internet Co.,Ltd.",主板,20180608,sh.601138,沪
3288,601139,深圳燃气,深圳,供气供热,深圳市燃气集团股份有限公司,Shenzhen Gas Corporation Ltd.,主板,20091225,sh.601139,沪
3289,601155,新城控股,江苏,区域地产,新城控股集团股份有限公司,"Seazen Holdings Co.,Ltd",主板,20151204,sh.601155,沪
3290,601156,东航物流,上海,空运,东方航空物流股份有限公司,"Eastern Air Logistics Co., Ltd.",主板,20210609,sh.601156,沪
3291,601158,重庆水务,重庆,水务,重庆水务集团股份有限公司,"Chongqing Water Group Co.,Ltd.",主板,20100329,sh.601158,沪
3292,601162,天风证券,湖北,证券,天风证券股份有限公司,"Tianfeng Securities Co.,Ltd",主板,20181019,sh.601162,沪
3293,601163,三角轮胎,山东,汽车配件,三角轮胎股份有限公司,"Triangle Tyre Co.,Ltd",主板,20160909,sh.601163,沪
3294,601166,兴业银行,福建,银行,兴业银行股份有限公司,"Industrial Bank Co.,Ltd.",主板,20070205,sh.601166,沪
3295,601168,西部矿业,青海,铜,西部矿业股份有限公司,"Western Mining Co.,Ltd.",主板,20070712,sh.601168,沪
3296,601169,北京银行,北京,银行,北京银行股份有限公司,"Bank of Beijing Co., Ltd.",主板,20070919,sh.601169,沪
3297,601177,杭齿前进,浙江,机械基件,杭州前进齿轮箱集团股份有限公司,"Hangzhou Advance Gearbox Group Co., Ltd.",主板,20101011,sh.601177,沪
3298,601179,中国西电,陕西,电气设备,中国西电电气股份有限公司,"China XD Electric Co.,Ltd",主板,20100128,sh.601179,沪
3299,601186,中国铁建,北京,建筑工程,中国铁建股份有限公司,China Railway Construction Corporation Limited,主板,20080310,sh.601186,沪
3300,601187,厦门银行,福建,银行,厦门银行股份有限公司,"Xiamen Bank Co.,Ltd",主板,20201027,sh.601187,沪
3301,601188,龙江交通,黑龙江,路桥,黑龙江交通发展股份有限公司,"Heilongjiang Transport Development Co.,Ltd",主板,20100319,sh.601188,沪
3302,601198,东兴证券,北京,证券,东兴证券股份有限公司,Dongxing Securities Company Limited,主板,20150226,sh.601198,沪
3303,601199,江南水务,江苏,水务,江苏江南水务股份有限公司,"Jiangsu Jiangnan Water Co.,Ltd.",主板,20110317,sh.601199,沪
3304,601200,上海环境,上海,环境保护,上海环境集团股份有限公司,"Shanghai Environment Group Co., Ltd.",主板,20170331,sh.601200,沪
3305,601208,东材科技,四川,化工原料,四川东材科技集团股份有限公司,"Sichuan Em Technology Co.,Ltd.",主板,20110520,sh.601208,沪
3306,601211,国泰君安,上海,证券,国泰君安证券股份有限公司,"Guotai Junan Securities Co., Ltd.",主板,20150626,sh.601211,沪
3307,601212,白银有色,甘肃,铜,白银有色集团股份有限公司,"Baiyin Nonferrous Group Co., Ltd.",主板,20170215,sh.601212,沪
3308,601216,君正集团,内蒙,化工原料,内蒙古君正能源化工集团股份有限公司,"Inner Mongolia Junzheng Energy & Chemical Group Co.,Ltd.",主板,20110222,sh.601216,沪
3309,601218,吉鑫科技,江苏,机械基件,江苏吉鑫风能科技股份有限公司,"Jiangsu SINOJIT Wind Energy Technology Co., Ltd.",主板,20110506,sh.601218,沪
3310,601222,林洋能源,江苏,电器仪表,江苏林洋能源股份有限公司,"Jiangsu Linyang Energy Co., Ltd.",主板,20110808,sh.601222,沪
3311,601225,陕西煤业,陕西,煤炭开采,陕西煤业股份有限公司,Shaanxi Coal Industry Company Limited,主板,20140128,sh.601225,沪
3312,601226,华电重工,北京,专用机械,华电重工股份有限公司,"Huadian Heavy Industries Co., Ltd.",主板,20141211,sh.601226,沪
3313,601228,广州港,广东,港口,广州港股份有限公司,Guangzhou Port Company Limited,主板,20170329,sh.601228,沪
3314,601229,上海银行,上海,银行,上海银行股份有限公司,"Bank of Shanghai Co., Ltd.",主板,20161116,sh.601229,沪
3315,601231,环旭电子,上海,元器件,环旭电子股份有限公司,"Universal Scientific Industrial(Shanghai)Co., Ltd.",主板,20120220,sh.601231,沪
3316,601233,桐昆股份,浙江,化纤,桐昆集团股份有限公司,"Tongkun Group Co.,Ltd",主板,20110518,sh.601233,沪
3317,601236,红塔证券,云南,证券,红塔证券股份有限公司,"HONGTA SECURITIES CO.,LTD.",主板,20190705,sh.601236,沪
3318,601238,广汽集团,广东,汽车整车,广州汽车集团股份有限公司,"Guangzhou Automobile Group Co., Ltd",主板,20120329,sh.601238,沪
3319,601258,庞大集团,河北,汽车服务,庞大汽贸集团股份有限公司,"Pang Da Automobile Trade Co., Ltd",主板,20110428,sh.601258,沪
3320,601279,英利汽车,吉林,汽车配件,长春英利汽车工业股份有限公司,"Changchun Engley Automobile Industry Co.,Ltd.",主板,20210415,sh.601279,沪
3321,601288,农业银行,北京,银行,中国农业银行股份有限公司,Agricultural Bank of China Limited,主板,20100715,sh.601288,沪
3322,601298,青岛港,山东,港口,青岛港国际股份有限公司,"Qingdao Port International Co., Ltd.",主板,20190121,sh.601298,沪
3323,601311,骆驼股份,湖北,电气设备,骆驼集团股份有限公司,"Camel Group Co.,Ltd.",主板,20110602,sh.601311,沪
3324,601318,中国平安,深圳,保险,中国平安保险(集团)股份有限公司,"Ping An Insurance (Group) Company of China, Ltd.",主板,20070301,sh.601318,沪
3325,601319,中国人保,北京,保险,中国人民保险集团股份有限公司,The People's Insurance Company (Group) of China Limited,主板,20181116,sh.601319,沪
3326,601326,秦港股份,河北,港口,秦皇岛港股份有限公司,"Qinhuangdao Port Co., Ltd.",主板,20170816,sh.601326,沪
3327,601328,交通银行,上海,银行,交通银行股份有限公司,"Bank of Communications Co.,Ltd.",主板,20070515,sh.601328,沪
3328,601330,绿色动力,深圳,环境保护,绿色动力环保集团股份有限公司,"Dynagreen Environmental Protection Group Co., Ltd.",主板,20180611,sh.601330,沪
3329,601333,广深铁路,深圳,铁路,广深铁路股份有限公司,Guangshen Railway Company Limited,主板,20061222,sh.601333,沪
3330,601336,新华保险,北京,保险,新华人寿保险股份有限公司,New China Life Insurance Company Ltd.,主板,20111216,sh.601336,沪
3331,601339,百隆东方,浙江,纺织,百隆东方股份有限公司,"Bros Eastern Co.,Ltd",主板,20120612,sh.601339,沪
3332,601360,三六零,天津,互联网,三六零安全科技股份有限公司,360 Security Technology Inc.,主板,20120116,sh.601360,沪
3333,601366,利群股份,山东,百货,利群商业集团股份有限公司,"Liqun Commercial Group Co.,Ltd.",主板,20170412,sh.601366,沪
3334,601368,绿城水务,广西,水务,广西绿城水务股份有限公司,"Guangxi Nanning Waterworks Co.,Ltd.",主板,20150612,sh.601368,沪
3335,601369,陕鼓动力,陕西,机械基件,西安陕鼓动力股份有限公司,"Xi'An Shaangu Power Co., Ltd.",主板,20100428,sh.601369,沪
3336,601375,中原证券,河南,证券,中原证券股份有限公司,"Central China Securities Co., Ltd.",主板,20170103,sh.601375,沪
3337,601377,兴业证券,福建,证券,兴业证券股份有限公司,"CHINA INDUSTRIAL SECURITIES CO.,LTD.",主板,20101013,sh.601377,沪
3338,601388,怡球资源,江苏,铝,怡球金属资源再生(中国)股份有限公司,Ye Chiu Metal Recycling ( China) Ltd.,主板,20120423,sh.601388,沪
3339,601390,中国中铁,北京,建筑工程,中国中铁股份有限公司,China Railway Group Limited,主板,20071203,sh.601390,沪
3340,601398,工商银行,北京,银行,中国工商银行股份有限公司,Industrial and Commercial Bank of China Limited,主板,20061027,sh.601398,沪
3341,601399,国机重装,四川,工程机械,国机重型装备集团股份有限公司,"Sinomach Heavy Equipment Group Co.,Ltd",主板,20200608,sh.601399,沪
3342,601456,国联证券,江苏,证券,国联证券股份有限公司,"Guolian Securities Co., Ltd.",主板,20200731,sh.601456,沪
3343,601500,通用股份,江苏,汽车配件,江苏通用科技股份有限公司,"Jiangsu General Science Technology Co.,Ltd",主板,20160919,sh.601500,沪
3344,601512,中新集团,江苏,园区开发,中新苏州工业园区开发集团股份有限公司,China-Singapore Suzhou Industrial Park Development Group Co.Ltd.,主板,20191220,sh.601512,沪
3345,601515,东风股份,广东,广告包装,汕头东风印刷股份有限公司,"Shantou Dongfeng Printing Co.,Ltd",主板,20120216,sh.601515,沪
3346,601518,吉林高速,吉林,路桥,吉林高速公路股份有限公司,"Jilin Expressway Co.,Ltd.",主板,20100319,sh.601518,沪
3347,601519,大智慧,上海,软件服务,上海大智慧股份有限公司,Shanghai DZH Limited,主板,20110128,sh.601519,沪
3348,601528,瑞丰银行,浙江,银行,浙江绍兴瑞丰农村商业银行股份有限公司,"Zhejiang Shaoxing Ruifeng Rural Commercial Bank Co.,Ltd.",主板,20210625,sh.601528,沪
3349,601555,东吴证券,江苏,证券,东吴证券股份有限公司,"Soochow Securities Co.,Ltd.",主板,20111212,sh.601555,沪
3350,601566,九牧王,福建,服饰,九牧王股份有限公司,"Joeone Co.,Ltd",主板,20110530,sh.601566,沪
3351,601567,三星医疗,浙江,电器仪表,宁波三星医疗电气股份有限公司,"Ningbo Sanxing Medical Electric Co. , Ltd.",主板,20110615,sh.601567,沪
3352,601568,北元集团,陕西,化工原料,陕西北元化工集团股份有限公司,"Shaanxi Beiyuan Chemical Industry Group Co., Ltd.",主板,20201020,sh.601568,沪
3353,601577,长沙银行,湖南,银行,长沙银行股份有限公司,"Bank of Changsha Co.,Ltd.",主板,20180926,sh.601577,沪
3354,601579,会稽山,浙江,红黄酒,会稽山绍兴酒股份有限公司,"Kuaijishan Shaoxing Rice Wine Co., Ltd.",主板,20140825,sh.601579,沪
3355,601588,北辰实业,北京,区域地产,北京北辰实业股份有限公司,Beijing North Star Company Limited,主板,20061016,sh.601588,沪
3356,601595,上海电影,上海,影视音像,上海电影股份有限公司,"Shanghai Film Co.,Ltd.",主板,20160817,sh.601595,沪
3357,601598,中国外运,北京,仓储物流,中国外运股份有限公司,Sinotrans Limited,主板,20190118,sh.601598,沪
3358,601599,浙文影业,江苏,纺织,浙文影业集团股份有限公司,"Zhewen Pictures Group co.,ltd",主板,20110527,sh.601599,沪
3359,601600,中国铝业,北京,铝,中国铝业股份有限公司,Aluminum Corporation of China Limited,主板,20070430,sh.601600,沪
3360,601601,中国太保,上海,保险,中国太平洋保险(集团)股份有限公司,"China Pacific Insurance (Group) Co., Ltd.",主板,20071225,sh.601601,沪
3361,601606,长城军工,安徽,专用机械,安徽长城军工股份有限公司,"Anhui GreatWall Military Industry Co., Ltd",主板,20180806,sh.601606,沪
3362,601607,上海医药,上海,医药商业,上海医药集团股份有限公司,"Shanghai Pharmaceuticals Holding Co.,Ltd",主板,19940324,sh.601607,沪
3363,601608,中信重工,河南,专用机械,中信重工机械股份有限公司,"CITIC Heavy Industries Co., Ltd",主板,20120706,sh.601608,沪
3364,601609,金田铜业,浙江,铜,宁波金田铜业(集团)股份有限公司,"Ningbo Jintian Copper(Group) Co., Ltd.",主板,20200422,sh.601609,沪
3365,601611,中国核建,上海,建筑工程,中国核工业建设股份有限公司,China Nuclear Engineering & Construction Corporation Limited,主板,20160606,sh.601611,沪
3366,601615,明阳智能,广东,机械基件,明阳智慧能源集团股份公司,Ming Yang Smart Energy Group Limited,主板,20190123,sh.601615,沪
3367,601616,广电电气,上海,电气设备,上海广电电气(集团)股份有限公司,"Shanghai Guangdian Electric Group Co., Ltd.",主板,20110201,sh.601616,沪
3368,601618,中国中冶,北京,建筑工程,中国冶金科工股份有限公司,Metallurgical Corporation of China Ltd.,主板,20090921,sh.601618,沪
3369,601619,嘉泽新能,宁夏,新型电力,宁夏嘉泽新能源股份有限公司,Ningxia Jiaze Renewables Corporation Limited,主板,20170720,sh.601619,沪
3370,601628,中国人寿,北京,保险,中国人寿保险股份有限公司,China Life Insurance Company Limited,主板,20070109,sh.601628,沪
3371,601633,长城汽车,河北,汽车整车,长城汽车股份有限公司,Great Wall Motor Company Limited,主板,20110928,sh.601633,沪
3372,601636,旗滨集团,湖南,玻璃,株洲旗滨集团股份有限公司,"Zhuzhou Kibing Group Co.,Ltd",主板,20110812,sh.601636,沪
3373,601658,邮储银行,北京,银行,中国邮政储蓄银行股份有限公司,"Postal Savings Bank of China Co.,Ltd.",主板,20191210,sh.601658,沪
3374,601665,齐鲁银行,山东,银行,齐鲁银行股份有限公司,"Qilu Bank Co.,Ltd",主板,20210618,sh.601665,沪
3375,601666,平煤股份,河南,煤炭开采,平顶山天安煤业股份有限公司,"Pingdingshan Tianan Coal. Mining Co.,Ltd.",主板,20061123,sh.601666,沪
3376,601668,中国建筑,北京,建筑工程,中国建筑股份有限公司,China State Construction Engineering Corporation Limited,主板,20090729,sh.601668,沪
3377,601669,中国电建,北京,建筑工程,中国电力建设股份有限公司,"Power Construction Corporation of China,Ltd",主板,20111018,sh.601669,沪
3378,601677,明泰铝业,河南,铝,河南明泰铝业股份有限公司,"Henan Mingtai Al.Industrial Co.,Ltd.",主板,20110919,sh.601677,沪
3379,601678,滨化股份,山东,化工原料,滨化集团股份有限公司,"Befar Group Co., Ltd",主板,20100223,sh.601678,沪
3380,601686,友发集团,天津,钢加工,天津友发钢管集团股份有限公司,"Tianjin You Fa Steel Pipe Group Stock Co.,Ltd.",主板,20201204,sh.601686,沪
3381,601688,华泰证券,江苏,证券,华泰证券股份有限公司,"Huatai Securities Co.,Ltd.",主板,20100226,sh.601688,沪
3382,601689,拓普集团,浙江,汽车配件,宁波拓普集团股份有限公司,"Ningbo Tuopu Group Co., Ltd.",主板,20150319,sh.601689,沪
3383,601696,中银证券,上海,证券,中银国际证券股份有限公司,"BOC International (China) Co., Ltd.",主板,20200226,sh.601696,沪
3384,601698,中国卫通,北京,电信运营,中国卫通集团股份有限公司,"China Satellite Communications Co.,Ltd.",主板,20190628,sh.601698,沪
3385,601699,潞安环能,山西,煤炭开采,山西潞安环保能源开发股份有限公司,"Shanxi Lu’an Environmental EnergyDev. Co.,Ltd",主板,20060922,sh.601699,沪
3386,601700,风范股份,江苏,电气设备,常熟风范电力设备股份有限公司,"Changshu Fengfan Power Equipment Co.,Ltd.",主板,20110118,sh.601700,沪
3387,601702,华峰铝业,上海,铝,上海华峰铝业股份有限公司,Shanghai Huafon Aluminium Corporation,主板,20200907,sh.601702,沪
3388,601717,郑煤机,河南,汽车配件,郑州煤矿机械集团股份有限公司,"Zhengzhou Coal Mining Machinery Group Co., Ltd",主板,20100803,sh.601717,沪
3389,601718,际华集团,北京,服饰,际华集团股份有限公司,Jihua Group Corporation Limited,主板,20100816,sh.601718,沪
3390,601727,上海电气,上海,电气设备,上海电气集团股份有限公司,Shanghai Electric Group Company Limited,主板,20081205,sh.601727,沪
3391,601766,中国中车,北京,运输设备,中国中车股份有限公司,CRRC Corporation Limited,主板,20080818,sh.601766,沪
3392,601777,力帆科技,重庆,摩托车,力帆科技(集团)股份有限公司,"Lifan Technology (Group) Co., Ltd.",主板,20101125,sh.601777,沪
3393,601778,晶科科技,江西,新型电力,晶科电力科技股份有限公司,"Jinko Power Technology Co., Ltd.",主板,20200519,sh.601778,沪
3394,601788,光大证券,上海,证券,光大证券股份有限公司,Everbright Securities Company Limited,主板,20090818,sh.601788,沪
3395,601789,宁波建工,浙江,建筑工程,宁波建工股份有限公司,"Ningbo Construction Co., Ltd",主板,20110816,sh.601789,沪
3396,601798,蓝科高新,甘肃,化工机械,甘肃蓝科石化高新装备股份有限公司,Lanpec Technologies Limited,主板,20110622,sh.601798,沪
3397,601799,星宇股份,江苏,汽车配件,常州星宇车灯股份有限公司,"Changzhou Xingyu Automotive Lighting Systems Co., Ltd.",主板,20110201,sh.601799,沪
3398,601800,中国交建,北京,建筑工程,中国交通建设股份有限公司,China Communications Construction Company Limited,主板,20120309,sh.601800,沪
3399,601801,皖新传媒,安徽,出版业,安徽新华传媒股份有限公司,"Anhui Xinhua Media Co., Ltd",主板,20100118,sh.601801,沪
3400,601808,中海油服,天津,石油开采,中海油田服务股份有限公司,China Oilfield Services Limited,主板,20070928,sh.601808,沪
3401,601811,新华文轩,四川,出版业,新华文轩出版传媒股份有限公司,"Xinhua Winshare Publishing & Media Co.,Ltd.",主板,20160808,sh.601811,沪
3402,601816,京沪高铁,北京,铁路,京沪高速铁路股份有限公司,"Beijing-Shanghai High Speed Railway Co.,Ltd.",主板,20200116,sh.601816,沪
3403,601818,光大银行,北京,银行,中国光大银行股份有限公司,China Everbright Bank Company Limited,主板,20100818,sh.601818,沪
3404,601827,三峰环境,重庆,环境保护,重庆三峰环境集团股份有限公司,"Chongqing Sanfeng Environment Group Corp., Ltd.",主板,20200605,sh.601827,沪
3405,601828,美凯龙,上海,其他商业,红星美凯龙家居集团股份有限公司,Red Star Macalline Group Corporation Ltd.,主板,20180117,sh.601828,沪
3406,601838,成都银行,四川,银行,成都银行股份有限公司,"Bank of Chengdu Co.,Ltd.",主板,20180131,sh.601838,沪
