,symbol,name,area,industry,fullname,enname,market,list_date,code,exchange
2034,300585,奥联电子,江苏,汽车配件,南京奥联汽车电子电器股份有限公司,"Nanjing Aolian Ae&Ea Co.,Ltd",创业板,20161229,sz.300585,深
2035,300586,美联新材,广东,化工原料,广东美联新材料股份有限公司,"Malion New Materials Co., Ltd.",创业板,20170104,sz.300586,深
2036,300587,天铁股份,浙江,橡胶,浙江天铁实业股份有限公司,"Zhejiang Tiantie Industry Co.,Ltd.",创业板,20170105,sz.300587,深
2037,300588,熙菱信息,新疆,软件服务,新疆熙菱信息技术股份有限公司,"Xinjiang Sailing Information Technology Co.,Ltd",创业板,20170105,sz.300588,深
2038,300589,江龙船艇,广东,船舶,江龙船艇科技股份有限公司,"Jianglong Shipbuilding Co.,Ltd",创业板,20170113,sz.300589,深
2039,300590,移为通信,上海,通信设备,上海移为通信技术股份有限公司,"Queclink Wireless Solutions Co., Ltd.",创业板,20170111,sz.300590,深
2040,300591,万里马,广东,服饰,广东万里马实业股份有限公司,"Guangdong Wanlima Industry Co.,Ltd.",创业板,20170110,sz.300591,深
2041,300592,华凯创意,湖南,软件服务,湖南华凯文化创意股份有限公司,"Hunan Huakai Cultural and Creative Co., Ltd.",创业板,20170120,sz.300592,深
2042,300593,新雷能,北京,电气设备,北京新雷能科技股份有限公司,"Beijing Relpow Technology Co., Ltd",创业板,20170113,sz.300593,深
2043,300594,朗进科技,山东,运输设备,山东朗进科技股份有限公司,"Shandong Longertek Technology Co., Ltd",创业板,20190621,sz.300594,深
2044,300595,欧普康视,安徽,医疗保健,欧普康视科技股份有限公司,AUTEK CHINA INC.,创业板,20170117,sz.300595,深
2045,300596,利安隆,天津,化工原料,天津利安隆新材料股份有限公司,Rianlon Corporation,创业板,20170119,sz.300596,深
2046,300597,吉大通信,吉林,通信设备,吉林吉大通信设计院股份有限公司,"Jilin Jlu Communication Design Institute Co., Ltd",创业板,20170123,sz.300597,深
2047,300598,诚迈科技,江苏,软件服务,诚迈科技(南京)股份有限公司,"ArcherMind Technology(Nanjing) Co.,Ltd.",创业板,20170120,sz.300598,深
2048,300599,雄塑科技,广东,塑料,广东雄塑科技集团股份有限公司,"Guangdong Xiongsu Technology Group Co., Ltd",创业板,20170123,sz.300599,深
2049,300600,国瑞科技,江苏,电气设备,常熟市国瑞科技股份有限公司,"Changshu Guorui Technology Co.,LTD.",创业板,20170125,sz.300600,深
2050,300601,康泰生物,深圳,生物制药,深圳康泰生物制品股份有限公司,"Shenzhen Kangtai Biological Products Co.,Ltd.",创业板,20170207,sz.300601,深
2051,300602,飞荣达,深圳,元器件,深圳市飞荣达科技股份有限公司,"Shenzhen frd science&Technology Co.,Ltd",创业板,20170126,sz.300602,深
2052,300603,立昂技术,新疆,通信设备,立昂技术股份有限公司,"Leon Technology Co., Ltd.",创业板,20170126,sz.300603,深
2053,300604,长川科技,浙江,专用机械,杭州长川科技股份有限公司,"Hangzhou Changchuan Technology Co.,Ltd",创业板,20170417,sz.300604,深
2054,300605,恒锋信息,福建,软件服务,恒锋信息科技股份有限公司,"Hengfeng Information Technology Co.,Ltd.",创业板,20170208,sz.300605,深
2055,300606,金太阳,广东,矿物制品,东莞金太阳研磨股份有限公司,"Dongguan Golden Sun Abrasives Co.,Ltd",创业板,20170208,sz.300606,深
2056,300607,拓斯达,广东,专用机械,广东拓斯达科技股份有限公司,"Guangdong Topstar Technology Co.,Ltd",创业板,20170209,sz.300607,深
2057,300608,思特奇,北京,软件服务,北京思特奇信息技术股份有限公司,"Si-Tech Information Technology Co.,Ltd",创业板,20170213,sz.300608,深
2058,300609,汇纳科技,上海,互联网,汇纳科技股份有限公司,"Winner Technology Co., Inc.",创业板,20170215,sz.300609,深
2059,300610,晨化股份,江苏,化工原料,扬州晨化新材料股份有限公司,"Yangzhou Chenhua New Material Co.,Ltd.",创业板,20170213,sz.300610,深
2060,300611,美力科技,浙江,汽车配件,浙江美力科技股份有限公司,"Zhejiang Meili High Technology Co,.Ltd.",创业板,20170220,sz.300611,深
2061,300612,宣亚国际,北京,广告包装,宣亚国际营销科技(北京)股份有限公司,"Shunya International Martech (Beijing) Co.,Ltd.",创业板,20170215,sz.300612,深
2062,300613,富瀚微,上海,半导体,上海富瀚微电子股份有限公司,"Shanghai Fullhan Microelectronics Co., Ltd.",创业板,20170220,sz.300613,深
2063,300614,百川畅银,河南,环境保护,河南百川畅银环保能源股份有限公司,"Henan BCCY Environmental Energy Co.,Ltd",创业板,20210525,sz.300614,深
2064,300615,欣天科技,深圳,元器件,深圳市欣天科技股份有限公司,Xdc Industries(Shenzhen)Limited,创业板,20170215,sz.300615,深
2065,300616,尚品宅配,广东,家居用品,广州尚品宅配家居股份有限公司,"Guangzhou Shangpin Home Collection Co.,Ltd",创业板,20170307,sz.300616,深
2066,300617,安靠智电,江苏,电气设备,江苏安靠智能输电工程科技股份有限公司,"Jiangsu Ankura Smart Transmission Engineering Technology Co.,Ltd.",创业板,20170228,sz.300617,深
2067,300618,寒锐钴业,江苏,小金属,南京寒锐钴业股份有限公司,"Nanjing Hanrui Cobalt Co., Ltd.",创业板,20170306,sz.300618,深
2068,300619,金银河,广东,专用机械,佛山市金银河智能装备股份有限公司,"Foshan Golden Milky Way Intelligent Equipment Co.,Ltd.",创业板,20170301,sz.300619,深
2069,300620,光库科技,广东,元器件,珠海光库科技股份有限公司,"Advanced Fiber Resources (Zhuhai), Ltd.",创业板,20170310,sz.300620,深
2070,300621,维业股份,深圳,装修装饰,深圳市维业装饰集团股份有限公司,"ShenZhen WeiYe Decoration Group Co.,LTD.",创业板,20170316,sz.300621,深
2071,300622,博士眼镜,深圳,其他商业,博士眼镜连锁股份有限公司,"Doctorglasses Chain Co., Ltd",创业板,20170315,sz.300622,深
2072,300623,捷捷微电,江苏,半导体,江苏捷捷微电子股份有限公司,"Jiangsu Jiejie Microelectronics Co., Ltd",创业板,20170314,sz.300623,深
2073,300624,万兴科技,西藏,软件服务,万兴科技集团股份有限公司,"Wondershare Technology Group Co.,Ltd",创业板,20180118,sz.300624,深
2074,300625,三雄极光,广东,半导体,广东三雄极光照明股份有限公司,"Guangdong Pak Corporation Co., Ltd.",创业板,20170317,sz.300625,深
2075,300626,华瑞股份,浙江,电气设备,华瑞电器股份有限公司,"Huarui Electrical Appliance Co.,Ltd.",创业板,20170320,sz.300626,深
2076,300627,华测导航,上海,通信设备,上海华测导航技术股份有限公司,Shanghai Huace Navigation Technology Ltd,创业板,20170321,sz.300627,深
2077,300628,亿联网络,福建,通信设备,厦门亿联网络技术股份有限公司,"YEALINK NETWORK TECHNOLOGY CO., LTD.",创业板,20170317,sz.300628,深
2078,300629,新劲刚,广东,元器件,广东新劲刚新材料科技股份有限公司,"King-Strong New Material Technology Co.,Ltd",创业板,20170324,sz.300629,深
2079,300630,普利制药,海南,化学制药,海南普利制药股份有限公司,"Hainan Poly Pharm. Co., Ltd.",创业板,20170328,sz.300630,深
2080,300631,久吾高科,江苏,环境保护,江苏久吾高科技股份有限公司,"Jiangsu Jiuwu Hi-Tech Co., Ltd.",创业板,20170323,sz.300631,深
2081,300632,光莆股份,福建,半导体,厦门光莆电子股份有限公司,"Xiamen Guang Pu Electronics Co.,Ltd.",创业板,20170406,sz.300632,深
2082,300633,开立医疗,深圳,医疗保健,深圳开立生物医疗科技股份有限公司,Sonoscape Medical Corp.,创业板,20170406,sz.300633,深
2083,300634,彩讯股份,深圳,软件服务,彩讯科技股份有限公司,"Richinfo Technology Co., Ltd.",创业板,20180323,sz.300634,深
2084,300635,中达安,广东,建筑工程,中达安股份有限公司,"SinoDaan Co., Ltd.",创业板,20170331,sz.300635,深
2085,300636,同和药业,江西,化学制药,江西同和药业股份有限公司,"Jiangxi Synergy Pharmaceutical Co.,Ltd.",创业板,20170331,sz.300636,深
2086,300637,扬帆新材,浙江,化工原料,浙江扬帆新材料股份有限公司,"Zhejiang Yangfan New Materials Co., Ltd.",创业板,20170412,sz.300637,深
2087,300638,广和通,深圳,通信设备,深圳市广和通无线股份有限公司,Fibocom Wireless Inc.,创业板,20170413,sz.300638,深
2088,300639,凯普生物,广东,医疗保健,广东凯普生物科技股份有限公司,"Guangdong Hybribio Biotech Co.,Ltd.",创业板,20170412,sz.300639,深
2089,300640,德艺文创,福建,文教休闲,德艺文化创意集团股份有限公司,"Profit Cultural & Creative Group Co.,Ltd.",创业板,20170417,sz.300640,深
2090,300641,正丹股份,江苏,化工原料,江苏正丹化学工业股份有限公司,"Jiangsu Zhengdan Chemical Industry Co., Ltd.",创业板,20170418,sz.300641,深
2091,300642,透景生命,上海,医疗保健,上海透景生命科技股份有限公司,Tellgen Corporation,创业板,20170421,sz.300642,深
2092,300643,万通智控,浙江,汽车配件,万通智控科技股份有限公司,"Hamaton Automotive Technology Co.,Ltd.",创业板,20170505,sz.300643,深
2093,300644,南京聚隆,江苏,塑料,南京聚隆科技股份有限公司,"Nanjing Julong Science & Technology Co., Ltd",创业板,20180206,sz.300644,深
2094,300645,正元智慧,浙江,软件服务,浙江正元智慧科技股份有限公司,"Zhejiang Zhengyuan Zhihui Technology Co.,Ltd",创业板,20170421,sz.300645,深
2095,300647,超频三,深圳,元器件,深圳市超频三科技股份有限公司,Shenzhen Fluence Technology Plc.,创业板,20170503,sz.300647,深
2096,300648,星云股份,福建,电器仪表,福建星云电子股份有限公司,"Fujian Nebula Electronics.,Ltd",创业板,20170425,sz.300648,深
2097,300649,杭州园林,浙江,建筑工程,杭州园林设计院股份有限公司,"Hangzhou Landscape Architecture Design Institute Co.,Ltd.",创业板,20170505,sz.300649,深
2098,300650,太龙照明,福建,电气设备,太龙(福建)商业照明股份有限公司,"Tecnon (Fujian) Commercial Lighting Co., Ltd",创业板,20170503,sz.300650,深
2099,300651,金陵体育,江苏,文教休闲,江苏金陵体育器材股份有限公司,"Jiangsu Jinling Sports Equipment Co., Ltd.",创业板,20170509,sz.300651,深
2100,300652,雷迪克,浙江,汽车配件,杭州雷迪克节能科技股份有限公司,"Hang Zhou Radical Energy-Saving Technology Co., Ltd.",创业板,20170516,sz.300652,深
2101,300653,正海生物,山东,医疗保健,烟台正海生物科技股份有限公司,"Yantai Zhenghai Bio-Tech Co.,Ltd.",创业板,20170516,sz.300653,深
2102,300654,世纪天鸿,山东,出版业,世纪天鸿教育科技股份有限公司,"Astro-century Education & Technology Co.,Ltd.",创业板,20170926,sz.300654,深
2103,300655,晶瑞股份,江苏,化工原料,苏州晶瑞化学股份有限公司,"Suzhou Crystal Clear Chemical Co.,Ltd",创业板,20170523,sz.300655,深
2104,300656,民德电子,深圳,IT设备,深圳市民德电子科技股份有限公司,Shenzhen MinDe Electronics Technology Ltd.,创业板,20170519,sz.300656,深
2105,300657,弘信电子,福建,元器件,厦门弘信电子科技集团股份有限公司,Xiamen Hongxin Electronics Technology Group Inc.,创业板,20170523,sz.300657,深
2106,300658,延江股份,福建,纺织,厦门延江新材料股份有限公司,Xiamen Yanjan New Material Co.Ltd.,创业板,20170602,sz.300658,深
2107,300659,中孚信息,山东,软件服务,中孚信息股份有限公司,Zhongfu Information Inc.,创业板,20170526,sz.300659,深
2108,300660,江苏雷利,江苏,电气设备,江苏雷利电机股份有限公司,"Jiangsu Leili Motor Co., Ltd",创业板,20170602,sz.300660,深
2109,300661,圣邦股份,北京,元器件,圣邦微电子(北京)股份有限公司,Sg Micro Corp,创业板,20170606,sz.300661,深
2110,300662,科锐国际,北京,综合类,北京科锐国际人力资源股份有限公司,"Beijing Career International Co., Ltd.",创业板,20170608,sz.300662,深
2111,300663,科蓝软件,北京,软件服务,北京科蓝软件系统股份有限公司,"Client Service International,Inc.",创业板,20170608,sz.300663,深
2112,300664,鹏鹞环保,江苏,环境保护,鹏鹞环保股份有限公司,"Penyao Environmental Protection Co., Ltd.",创业板,20180105,sz.300664,深
2113,300665,飞鹿股份,湖南,染料涂料,株洲飞鹿高新材料技术股份有限公司,"Zhuzhou Feilu High-Tech Materials Co., Ltd",创业板,20170613,sz.300665,深
2114,300666,江丰电子,浙江,元器件,宁波江丰电子材料股份有限公司,"Konfoong Materials International Co., Ltd.",创业板,20170615,sz.300666,深
2115,300667,必创科技,北京,电器仪表,北京必创科技股份有限公司,Beijing Beetech Inc.,创业板,20170619,sz.300667,深
2116,300668,杰恩设计,深圳,装修装饰,深圳市杰恩创意设计股份有限公司,"Shenzhen Jiang&Associates Creative Design Co., Ltd.",创业板,20170619,sz.300668,深
2117,300669,沪宁股份,浙江,机械基件,杭州沪宁电梯部件股份有限公司,"Hangzhou Huning Elevator Parts Co., Ltd.",创业板,20170629,sz.300669,深
2118,300670,大烨智能,江苏,电气设备,江苏大烨智能电气股份有限公司,"Jiangsu Daybright Intelligent Electric Co.,Ltd",创业板,20170703,sz.300670,深
2119,300671,富满电子,深圳,半导体,富满微电子集团股份有限公司,"Fine Made Microelectronics Group CO., LTD.",创业板,20170705,sz.300671,深
2120,300672,国科微,湖南,半导体,湖南国科微电子股份有限公司,"Hunan Goke Microelectronics Co., Ltd.",创业板,20170712,sz.300672,深
2121,300673,佩蒂股份,浙江,饲料,佩蒂动物营养科技股份有限公司,"Petpal Pet Nutrition Technology Co., Ltd.",创业板,20170711,sz.300673,深
2122,300674,宇信科技,北京,软件服务,北京宇信科技集团股份有限公司,"Yusys Technologies Co., Ltd.",创业板,20181107,sz.300674,深
2123,300675,建科院,深圳,建筑工程,深圳市建筑科学研究院股份有限公司,"Shenzhen Institute of Building Research Co.,Ltd.",创业板,20170719,sz.300675,深
2124,300676,华大基因,深圳,医疗保健,深圳华大基因股份有限公司,"Bgi Genomics Co., Ltd",创业板,20170714,sz.300676,深
2125,300677,英科医疗,山东,医疗保健,英科医疗科技股份有限公司,"Intco Medical Technology Co.,Ltd.",创业板,20170721,sz.300677,深
2126,300678,中科信息,四川,软件服务,中科院成都信息技术股份有限公司,"Chengdu Information Technology of Chinese Academy of Sciences Co., Ltd.",创业板,20170728,sz.300678,深
2127,300679,电连技术,深圳,元器件,电连技术股份有限公司,"Electric Connector Technology Co.,Ltd.",创业板,20170731,sz.300679,深
2128,300680,隆盛科技,江苏,汽车配件,无锡隆盛科技股份有限公司,"Wuxi Longsheng Technology Co., Ltd",创业板,20170725,sz.300680,深
2129,300681,英搏尔,广东,汽车配件,珠海英搏尔电气股份有限公司,"Zhuhai Enpower Electric Co.,Ltd.",创业板,20170725,sz.300681,深
2130,300682,朗新科技,江苏,软件服务,朗新科技集团股份有限公司,"Longshine Technology Group Co., Ltd.",创业板,20170801,sz.300682,深
2131,300683,海特生物,湖北,生物制药,武汉海特生物制药股份有限公司,"Wuhan Hiteck Biological Pharma Co.,Ltd.",创业板,20170808,sz.300683,深
2132,300684,中石科技,北京,化工原料,北京中石伟业科技股份有限公司,Jones Tech PLC,创业板,20171227,sz.300684,深
2133,300685,艾德生物,福建,生物制药,厦门艾德生物医药科技股份有限公司,"Amoy Diagnostics Co., Ltd.",创业板,20170802,sz.300685,深
2134,300686,智动力,深圳,元器件,深圳市智动力精密技术股份有限公司,"Shenzhen CDL Precision Technology Co., Ltd.",创业板,20170804,sz.300686,深
2135,300687,赛意信息,广东,软件服务,广州赛意信息科技股份有限公司,"Guangzhou Sie Consulting Co., Ltd.",创业板,20170803,sz.300687,深
2136,300688,创业黑马,北京,综合类,创业黑马科技集团股份有限公司,Dark Horse Technology Group Co. Ltd,创业板,20170810,sz.300688,深
2137,300689,澄天伟业,深圳,元器件,深圳市澄天伟业科技股份有限公司,"Shenzhen Chengtian Weiye Technology Co.,Ltd.",创业板,20170809,sz.300689,深
2138,300690,双一科技,山东,电气设备,山东双一科技股份有限公司,"Shandong Shuangyi Technology Co.,Ltd.",创业板,20170808,sz.300690,深
2139,300691,联合光电,广东,元器件,中山联合光电科技股份有限公司,"Union Optech Co.,Ltd.",创业板,20170811,sz.300691,深
2140,300692,中环环保,安徽,环境保护,安徽中环环保科技股份有限公司,"Anhui Zhonghuan Environmental Protection Technology Co.,Ltd",创业板,20170821,sz.300692,深
2141,300693,盛弘股份,深圳,电气设备,深圳市盛弘电气股份有限公司,"Shenzhen Sinexcel Electric Co.,Ltd.",创业板,20170822,sz.300693,深
2142,300694,蠡湖股份,江苏,汽车配件,无锡蠡湖增压技术股份有限公司,Wuxi Lihu Corporation Limited.,创业板,20181015,sz.300694,深
2143,300695,兆丰股份,浙江,汽车配件,浙江兆丰机电股份有限公司,"Zhejiang Zhaofeng Mechanical and Electronic Co.,Ltd.",创业板,20170908,sz.300695,深
2144,300696,爱乐达,四川,航空,成都爱乐达航空制造股份有限公司,Chengdu Ald Aviation Manufacturing Corporation,创业板,20170822,sz.300696,深
2145,300697,电工合金,江苏,铜,江阴电工合金股份有限公司,"Jiangyin Electrical Alloy Co., Ltd",创业板,20170907,sz.300697,深
2146,300698,万马科技,浙江,通信设备,万马科技股份有限公司,"Wanma Technology Co.,Ltd.",创业板,20170831,sz.300698,深
2147,300699,光威复材,山东,化工原料,威海光威复合材料股份有限公司,Weihai Guangwei Composites Co.Ltd,创业板,20170901,sz.300699,深
2148,300700,岱勒新材,湖南,矿物制品,长沙岱勒新材料科技股份有限公司,"Changsha DIALINE New Material Sci.&Tech. Co., Ltd.",创业板,20170912,sz.300700,深
2149,300701,森霸传感,河南,元器件,森霸传感科技股份有限公司,"Senba Sensing Technology Co.,Ltd.",创业板,20170915,sz.300701,深
2150,300702,天宇股份,浙江,化学制药,浙江天宇药业股份有限公司,"Zhejiang Tianyu Pharmaceutical Co., Ltd.",创业板,20170919,sz.300702,深
2151,300703,创源股份,浙江,文教休闲,宁波创源文化发展股份有限公司,"Cre8 Direct (Ningbo) Co.,Ltd.",创业板,20170919,sz.300703,深
2152,300705,九典制药,湖南,化学制药,湖南九典制药股份有限公司,"Hunan Jiudian Pharmaceutical Co., Ltd.",创业板,20171010,sz.300705,深
2153,300706,阿石创,福建,元器件,福建阿石创新材料股份有限公司,"Fujian Acetron New Materials Co.,Ltd",创业板,20170926,sz.300706,深
2154,300707,威唐工业,江苏,专用机械,无锡威唐工业技术股份有限公司,"Vt Industrial Technology Co., Ltd",创业板,20171010,sz.300707,深
2155,300708,聚灿光电,江苏,半导体,聚灿光电科技股份有限公司,"Focus Lightings Tech Co.,Ltd.",创业板,20171016,sz.300708,深
2156,300709,精研科技,江苏,元器件,江苏精研科技股份有限公司,"Jiangsu Gian Technology Co., Ltd.",创业板,20171019,sz.300709,深
2157,300710,万隆光电,浙江,通信设备,杭州万隆光电设备股份有限公司,"Hangzhou Prevail Optoelectronic Equipment Co.,Ltd.",创业板,20171019,sz.300710,深
2158,300711,广哈通信,广东,通信设备,广州广哈通信股份有限公司,Ght Co. Ltd.,创业板,20171101,sz.300711,深
2159,300712,永福股份,福建,建筑工程,福建永福电力设计股份有限公司,"Fujian Yongfu Power Engineering Co.,Ltd",创业板,20171031,sz.300712,深
2160,300713,英可瑞,深圳,电气设备,深圳市英可瑞科技股份有限公司,"Shenzhen Increase Technology Co., Ltd",创业板,20171101,sz.300713,深
2161,300715,凯伦股份,江苏,其他建材,江苏凯伦建材股份有限公司,"Jiangsu Canlon Building Materials Co.,Ltd.",创业板,20171026,sz.300715,深
2162,300716,国立科技,广东,塑料,广东国立科技股份有限公司,"GUANGDONG GUOLI SCI&TECH CO.,LTD.",创业板,20171109,sz.300716,深
2163,300717,华信新材,江苏,塑料,江苏华信新材料股份有限公司,"Jiangsu Huaxin New Material Co.,Ltd.",创业板,20171106,sz.300717,深
2164,300718,长盛轴承,浙江,机械基件,浙江长盛滑动轴承股份有限公司,"Zhejiang Changsheng Sliding Bearings Co.,Ltd.",创业板,20171106,sz.300718,深
2165,300719,安达维尔,北京,航空,北京安达维尔科技股份有限公司,"Beijing Andawell Science & Technology Co.,Ltd.",创业板,20171109,sz.300719,深
2166,300720,海川智能,广东,电器仪表,广东海川智能机器股份有限公司,"Guangdong High Dream Intellectualized Machinery Co., Ltd.",创业板,20171106,sz.300720,深
2167,300721,怡达股份,江苏,化工原料,江苏怡达化学股份有限公司,"Jiangsu Yida Chemical Co.,Ltd.",创业板,20171115,sz.300721,深
2168,300722,新余国科,江西,专用机械,江西新余国科科技股份有限公司,"Jiangxi Xinyu Guoke Technology Co.,Ltd",创业板,20171110,sz.300722,深
2169,300723,一品红,广东,化学制药,一品红药业股份有限公司,"Yipinhong Pharmaceutical Co., Ltd",创业板,20171116,sz.300723,深
2170,300724,捷佳伟创,深圳,专用机械,深圳市捷佳伟创新能源装备股份有限公司,Shenzhen S.C New Energy Technology Corporation,创业板,20180810,sz.300724,深
2171,300725,药石科技,江苏,化学制药,南京药石科技股份有限公司,"Pharmablock Sciences (Nanjing), Inc.",创业板,20171110,sz.300725,深
2172,300726,宏达电子,湖南,元器件,株洲宏达电子股份有限公司,"Zhuzhou Hongda Electronics Corp.,Ltd.",创业板,20171121,sz.300726,深
2173,300727,润禾材料,浙江,化工原料,宁波润禾高新材料科技股份有限公司,"Ningbo Runhe High-Tech Materials Co.,Ltd.",创业板,20171127,sz.300727,深
2174,300729,乐歌股份,浙江,家居用品,乐歌人体工学科技股份有限公司,Loctek Ergonomic Technology Corp.,创业板,20171201,sz.300729,深
2175,300730,科创信息,湖南,软件服务,湖南科创信息技术股份有限公司,"Hunan Creator Information Technologies Co., Ltd.",创业板,20171205,sz.300730,深
2176,300731,科创新源,深圳,橡胶,深圳科创新源新材料股份有限公司,"Shenzhen Cotran New Material Co., Ltd.",创业板,20171208,sz.300731,深
2177,300732,设研院,河南,建筑工程,河南省交通规划设计研究院股份有限公司,"Henan Provincial Communications Planning & Design Institute Co., Ltd",创业板,20171212,sz.300732,深
2178,300733,西菱动力,四川,汽车配件,成都西菱动力科技股份有限公司,Chengdu Xiling Power Science & Technology Incorporated Company,创业板,20180116,sz.300733,深
2179,300735,光弘科技,广东,通信设备,惠州光弘科技股份有限公司,"DBG Technology Co., Ltd.",创业板,20171229,sz.300735,深
2180,300736,百邦科技,北京,通信设备,北京百华悦邦科技股份有限公司,Bybon Group Company Limited,创业板,20180109,sz.300736,深
2181,300737,科顺股份,广东,其他建材,科顺防水科技股份有限公司,"Keshun Waterproof Technologies Co., Ltd.",创业板,20180125,sz.300737,深
2182,300738,奥飞数据,广东,电信运营,广东奥飞数据科技股份有限公司,"Guangdong Aofei Data Technology Co., Ltd.",创业板,20180119,sz.300738,深
2183,300739,明阳电路,深圳,元器件,深圳明阳电路科技股份有限公司,"Sunshine Global Circuits Co.,Ltd.",创业板,20180201,sz.300739,深
2184,300740,水羊股份,湖南,日用化工,水羊集团股份有限公司,"SYoung Group Co., Ltd.",创业板,20180208,sz.300740,深
2185,300741,华宝股份,西藏,食品,华宝香精股份有限公司,"Huabao Flavours & Fragrances Co.,Ltd",创业板,20180301,sz.300741,深
2186,300742,越博动力,江苏,汽车配件,南京越博动力系统股份有限公司,"Nanjng YueBoo Power System Co., Ltd.",创业板,20180508,sz.300742,深
2187,300743,天地数码,浙江,IT设备,杭州天地数码科技股份有限公司,"Hangzhou Todaytec Digital Co., Ltd",创业板,20180427,sz.300743,深
2188,300745,欣锐科技,深圳,汽车配件,深圳欣锐科技股份有限公司,"Shinry Technologies Co.,Ltd",创业板,20180523,sz.300745,深
2189,300746,汉嘉设计,浙江,建筑工程,汉嘉设计集团股份有限公司,"Hanjia Design Group Co.,Ltd.",创业板,20180525,sz.300746,深
2190,300747,锐科激光,湖北,元器件,武汉锐科光纤激光技术股份有限公司,"Wuhan Raycus Fiber Laser Technologies Co., Ltd.",创业板,20180625,sz.300747,深
2191,300748,金力永磁,江西,元器件,江西金力永磁科技股份有限公司,"Jl Mag Rare-Earth Co.,Ltd.",创业板,20180921,sz.300748,深
2192,300749,顶固集创,广东,家居用品,广东顶固集创家居股份有限公司,"Guangdong Topstrong Living Innovation & Integration Co.,Ltd.",创业板,20180925,sz.300749,深
2193,300750,宁德时代,福建,电气设备,宁德时代新能源科技股份有限公司,"Contemporary Amperex Technology Co., Limited",创业板,20180611,sz.300750,深
2194,300751,迈为股份,江苏,专用机械,苏州迈为科技股份有限公司,"Suzhou Maxwell Technologies Co., Ltd.",创业板,20181109,sz.300751,深
2195,300752,隆利科技,深圳,元器件,深圳市隆利科技股份有限公司,"Shenzhen Longli Technology Co.,Ltd",创业板,20181130,sz.300752,深
2196,300753,爱朋医疗,江苏,医疗保健,江苏爱朋医疗科技股份有限公司,"Jiangsu Apon Medical Technology Co., Ltd.",创业板,20181213,sz.300753,深
2197,300755,华致酒行,云南,其他商业,华致酒行连锁管理股份有限公司,"Vats Liquor Chain Store Management Joint Stock Co., Ltd.",创业板,20190129,sz.300755,深
